EAN,EAN_OnPage,ASIN,SupplierTitle,AmazonTitle,SupplierURL,AmazonURL,bought_in_past_month,fba_seller_count,fbm_seller_count,total_offer_count,SupplierPrice_incVAT,SupplierPrice_exVAT,SellingPrice_incVAT,ReferralFee,FBAFee,PrepHouseFee,OutputVAT,InputVAT,NetProceeds,HMRC,NetProfit,ROI,Breakeven,ProfitMargin
5053249220949,,B0D4N6R7YG,151 White Furniture Touch Up Pen 7ml CDU,"LG OLED48C45LA 48-Inch OLED Evo 4K UHD Smart TV, (α9 AI Processor Gen7, Dolby Atmos, Freeview Play and Amazon Alexa, 120Hz), Umber Brown [Model 2024]",https://www.poundwholesale.co.uk/151-white-furniture-touch-up-pen-7ml-cdu,https://www.amazon.co.uk/dp/B0D4N6R7YG,500.0,,,,0.93,0.775,799.0,119.85,2.8,0.55,133.16666666666669,0.15500000000000003,542.2533333333334,133.01166666666668,408.6916666666668,30844.654088050316,124.13,51.15039632874427
5055441449883,5055441449883,B0DJBWF73M,"Dekton Gloss & Emulsion Assorted Mini Paint Roller Set 4"" 6pc","Dekton 4"" Mixed Set 6pc-Gloss & Emulsion| High Density Foam Sleeves For Paints & Varnishes| Medium Pile Woven Fabric Sleeves| Durable Finish, Seamless Repairs On Nicks| 2 Gloss, 2 Woven Roller, Tray",https://www.poundwholesale.co.uk/dekton-gloss-emulsion-assorted-mini-paint-roller-set-4-6pc,https://www.amazon.co.uk/dp/B0DJBWF73M,,Available (see Keepa data),,2.0,1.69,1.4083333333333334,5.99,0.78,2.67,0.55,0.9983333333333335,0.2816666666666667,-0.14833333333333343,0.7166666666666668,-1.4150000000000003,-72.25531914893618,5.6899999999999995,-23.622704507512523
5038673720654,5038673720654,B09RM3D4SM,Marksman Plasterboard & Drywall Tape 48mm X 20m,"Marksman Plasterboard and Drywall Mesh Tape - 48mm x 20m, White",https://www.poundwholesale.co.uk/marksman-plasterboard-drywall-tape-48mm-x-20m,https://www.amazon.co.uk/dp/B09RM3D4SM,,,,1.0,0.85,0.7083333333333334,5.9,1.16,2.65,0.55,0.9833333333333335,0.1416666666666667,0.25666666666666693,0.8416666666666668,-1.1349999999999998,-90.19867549668874,5.21,-19.237288135593218
5053249247304,5053249247304,B09M3Q98MK,151 Gorilla Filler Plasterboard & Drywall Mesh Tape 50m,Gorilla Filler Plasterboard & Drywall Mesh Tape 50m,https://www.poundwholesale.co.uk/151-gorilla-filler-plasterboard-drywall-mesh-tape-50m,https://www.amazon.co.uk/dp/B09M3Q98MK,100.0,Available (see Keepa data),Available (see Keepa data),14.0,1.27,1.0583333333333333,4.51,0.59,2.65,0.55,0.7516666666666667,0.21166666666666667,-0.7516666666666667,0.54,-1.8416666666666668,-114.5077720207254,5.06,-40.83518107908352
5055441449906,5055441449906,B0DJ931RCH,"Dekton Emulsion Paint Roller & Tray 9"" Set","Dekton 9"" Roller And Tray Emulsion Ceilings And Walls - Woven roller for emulsion| Ideal for emulsion paints on walls and ceilings| Medium Pile Woven Fabric Sleeves| Durable Finish| Seamless Repairs",https://www.poundwholesale.co.uk/dekton-emulsion-paint-roller-tray-9-set,https://www.amazon.co.uk/dp/B0DJ931RCH,,,Available (see Keepa data),3.0,2.66,2.216666666666667,3.99,0.52,3.48,0.55,0.665,0.44333333333333336,-3.335,0.22166666666666668,-4.1066666666666665,-148.43373493975903,7.21,-102.92397660818713
